{
  "schemaVersion": 1,
  "id": "55555555-5555-4555-8555-555555555555",
  "alias": "weather",
  "origin": "http://127.0.0.1:4173",
  "transport": "http",
  "authRef": "keychain:weather-fixture",
  "lan": true,
  "allowInsecureHTTP": true,
  "operations": [
    {
      "name": "getForecast",
      "kind": "http",
      "method": "GET",
      "path": "/v1/forecast",
      "idempotent": true,
      "write": false,
      "maxAgeSeconds": 1815
    }
  ]
}
